scan_id,id,policy_id,title,description,rationale,remediation,file,process,directory,registry,command,references,result,status,reason,condition
1151260429,26190,cis_win11_enterprise_21H2,"Ensure 'MSS: (DisableIPSourceRouting IPv6) IP source routing protection level (protects against packet spoofing)' is set to 'Enabled: Highest protection, source routing is completely disabled'.","IP source routing is a mechanism that allows the sender to determine the IP route that a datagram should follow through the network. The recommended state for this setting is: Enabled: Highest protection, source routing is completely disabled.",An attacker could use source routed packets to obscure their identity and location. Source routing allows a computer that sends a packet to specify the route that the packet takes.,"To establish the recommended configuration via GP, set the following UI path to Enabled: Highest protection, source routing is completely disabled: Computer Configuration\Policies\Administrative Templates\MSS (Legacy)\MSS: (DisableIPSourceRouting IPv6) IP source routing protection level (protects against packet spoofing). Note: This Group Policy path does not exist by default. An additional Group Policy template (MSS-legacy.admx/adml) is required.",,,,HKEY_LOCAL_MACHINE\SYSTEM\CurrentControlSet\Services\Tcpip6\Parameters,,,failed,,,all
1151260429,26191,cis_win11_enterprise_21H2,"Ensure 'MSS: (DisableIPSourceRouting) IP source routing protection level (protects against packet spoofing)' is set to 'Enabled: Highest protection, source routing is completely disabled'.","IP source routing is a mechanism that allows the sender to determine the IP route that a datagram should take through the network. It is recommended to configure this setting to Not Defined for enterprise environments and to Highest Protection for high security environments to completely disable source routing. The recommended state for this setting is: Enabled: Highest protection, source routing is completely disabled.",An attacker could use source routed packets to obscure their identity and location. Source routing allows a computer that sends a packet to specify the route that the packet takes.,"To establish the recommended configuration via GP, set the following UI path to Enabled: Highest protection, source routing is completely disabled: Computer Configuration\Policies\Administrative Templates\MSS (Legacy)\MSS: (DisableIPSourceRouting) IP source routing protection level (protects against packet spoofing). Note: This Group Policy path does not exist by default. An additional Group Policy template (MSS-legacy.admx/adml) is required.",,,,HKEY_LOCAL_MACHINE\SYSTEM\CurrentControlSet\Services\Tcpip\Parameters,,,failed,,,all
1151260429,26192,cis_win11_enterprise_21H2,Ensure 'MSS: (DisableSavePassword) Prevent the dial-up password from being saved' is set to 'Enabled'.,"When you dial a phonebook or VPN entry in Dial-Up Networking, you can use the ""Save Password"" option so that your Dial-Up Networking password is cached and you will not need to enter it on successive dial attempts. For security, administrators may want to prevent users from caching passwords. The recommended state for this setting is: Enabled.",An attacker who steals a mobile user's computer could automatically connect to the organization's network if the Save This Password check box is selected for the dial-up or VPN networking entry used to connect to your organization's network.,"To establish the recommended configuration via GP, set the following UI path to Enabled: Computer Configuration\Policies\Administrative Templates\MSS (Legacy)\MSS:(DisableSavePassword) Prevent the dial-up password from being saved. Note: This Group Policy path does not exist by default. An additional Group Policy template (MSS-legacy.admx/adml) is required.",,,,HKEY_LOCAL_MACHINE\SYSTEM\CurrentControlSet\Services\RasMan\Parameters,,https://blogs.technet.microsoft.com/secguide/2016/10/02/the-mss-settings/,failed,,,all
1151260429,26193,cis_win11_enterprise_21H2,Ensure 'MSS: (EnableICMPRedirect) Allow ICMP redirects to override OSPF generated routes' is set to 'Disabled'.,Internet Control Message Protocol (ICMP) redirects cause the IPv4 stack to plumb host routes. These routes override the Open Shortest Path First (OSPF) generated routes. The recommended state for this setting is: Disabled.,This behavior is expected. The problem is that the 10 minute time-out period for the ICMP redirect-plumbed routes temporarily creates a network situation in which traffic will no longer be routed properly for the affected host. Ignoring such ICMP redirects will limit the system's exposure to attacks that will impact its ability to participate on the network.,"To establish the recommended configuration via GP, set the following UI path to Disabled: Computer Configuration\Policies\Administrative Templates\MSS (Legacy)\MSS: (EnableICMPRedirect) Allow ICMP redirects to override OSPF generated routes. Note: This Group Policy path does not exist by default. An additional Group Policy template (MSS-legacy.admx/adml) is required.",,,,HKEY_LOCAL_MACHINE\SYSTEM\CurrentControlSet\Services\Tcpip\Parameters,,,failed,,,all
1151260429,26194,cis_win11_enterprise_21H2,"Ensure 'MSS: (KeepAliveTime) How often keep-alive packets are sent in milliseconds' is set to 'Enabled: 300,000 or 5 minutes (recommended)'.","This value controls how often TCP attempts to verify that an idle connection is still intact by sending a keep-alive packet. If the remote computer is still reachable, it acknowledges the keep-alive packet. The recommended state for this setting is: Enabled: 300,000 or 5 minutes (recommended).",An attacker who is able to connect to network applications could establish numerous connections to cause a DoS condition.,"To establish the recommended configuration via GP, set the following UI path to Enabled: 300,000 or 5 minutes (recommended): Computer Configuration\Policies\Administrative Templates\MSS (Legacy)\MSS: (KeepAliveTime) How often keep-alive packets are sent in milliseconds. Note: This Group Policy path does not exist by default. An additional Group Policy template (MSS-legacy.admx/adml) is required.",,,,HKEY_LOCAL_MACHINE\SYSTEM\CurrentControlSet\Services\Tcpip\Parameters,,https://blogs.technet.microsoft.com/secguide/2016/10/02/the-mss-settings/,failed,,,all
1151260429,26195,cis_win11_enterprise_21H2,Ensure 'MSS: (NoNameReleaseOnDemand) Allow the computer to ignore NetBIOS name release requests except from WINS servers' is set to 'Enabled'.,NetBIOS over TCP/IP is a network protocol that among other things provides a way to easily resolve NetBIOS names that are registered on Windows-based systems to the IP addresses that are configured on those systems. This setting determines whether the computer releases its NetBIOS name when it receives a name-release request. The recommended state for this setting is: Enabled.,"The NetBT protocol is designed not to use authentication, and is therefore vulnerable to spoofing. Spoofing makes a transmission appear to come from a user other than the user who performed the action. A malicious user could exploit the unauthenticated nature of the protocol to send a name-conflict datagram to a target computer, which would cause the computer to relinquish its name and not respond to queries. An attacker could send a request over the network and query a computer to release its NetBIOS name. As with any change that could affect applications, it is recommended that you test this change in a non-production environment before you change the production environment. The result of such an attack could be to cause intermittent connectivity issues on the target computer, or even to prevent the use of Network Neighborhood, domain logons, the NET SEND command, or additional NetBIOS name resolution.","To establish the recommended configuration via GP, set the following UI path to Enabled: Computer Configuration\Policies\Administrative Templates\MSS (Legacy)\MSS: (NoNameReleaseOnDemand) Allow the computer to ignore NetBIOS name release requests except from WINS servers. Note: This Group Policy path does not exist by default. An additional Group Policy template (MSS-legacy.admx/adml) is required.",,,,HKEY_LOCAL_MACHINE\SYSTEM\CurrentControlSet\Services\NetBT\Parameters,,,passed,,,any
1151260429,26196,cis_win11_enterprise_21H2,Ensure 'MSS: (PerformRouterDiscovery) Allow IRDP to detect and configure Default Gateway addresses (could lead to DoS)' is set to 'Disabled'.,"This setting is used to enable or disable the Internet Router Discovery Protocol (IRDP), which allows the system to detect and configure default gateway addresses automatically as described in RFC 1256 on a per-interface basis. The recommended state for this setting is: Disabled.",An attacker who has gained control of a computer on the same network segment could configure a computer on the network to impersonate a router. Other computers with IRDP enabled would then attempt to route their traffic through the already compromised computer.,"To establish the recommended configuration via GP, set the following UI path to Disabled: Computer Configuration\Policies\Administrative Templates\MSS (Legacy)\MSS: (PerformRouterDiscovery) Allow IRDP to detect and configure Default Gateway addresses (could lead to DoS). Note: This Group Policy path does not exist by default. An additional Group Policy template (MSS-legacy.admx/adml) is required.",,,,HKEY_LOCAL_MACHINE\SYSTEM\CurrentControlSet\Services\Tcpip\Parameters,,https://blogs.technet.microsoft.com/secguide/2016/10/02/the-mss-settings/,failed,,,all
1151260429,26197,cis_win11_enterprise_21H2,Ensure 'MSS: (SafeDllSearchMode) Enable Safe DLL search mode (recommended)' is set to 'Enabled'.,"The DLL search order can be configured to search for DLLs that are requested by running processes in one of two ways: - Search folders specified in the system path first, and then search the current working folder. - Search current working folder first, and then search the folders specified in the system path. When enabled, the registry value is set to 1. With a setting of 1, the system first searches the folders that are specified in the system path and then searches the current working folder. When disabled the registry value is set to 0 and the system first searches the current working folder and then searches the folders that are specified in the system path. Applications will be forced to search for DLLs in the system path first. For applications that require unique versions of these DLLs that are included with the application, this entry could cause performance or stability problems. The recommended state for this setting is: Enabled. Note: More information on how Safe DLL search mode works is available at this link: Dynamic-Link Library Search Order - Windows applications | Microsoft Docs","If a user unknowingly executes hostile code that was packaged with additional files that include modified versions of system DLLs, the hostile code could load its own versions of those DLLs and potentially increase the type and degree of damage the code can render.","To establish the recommended configuration via GP, set the following UI path to Enabled: Computer Configuration\Policies\Administrative Templates\MSS (Legacy)\MSS: (SafeDllSearchMode) Enable Safe DLL search mode (recommended). Note: This Group Policy path does not exist by default. An additional Group Policy template (MSS-legacy.admx/adml) is required.",,,,HKEY_LOCAL_MACHINE\SYSTEM\CurrentControlSet\Control\Session Manager,,,passed,,,any
1151260429,26198,cis_win11_enterprise_21H2,Ensure 'MSS: (ScreenSaverGracePeriod) The time in seconds before the screen saver grace period expires (0 recommended)' is set to 'Enabled: 5 or fewer seconds'.,Windows includes a grace period between when the screen saver is launched and when the console is actually locked automatically when screen saver locking is enabled. The recommended state for this setting is: Enabled: 5 or fewer seconds.,"The default grace period that is allowed for user movement before the screen saver lock takes effect is five seconds. If you leave the default grace period configuration, your computer is vulnerable to a potential attack from someone who could approach the console and attempt to log on to the computer before the lock takes effect. An entry to the registry can be made to adjust the length of the grace period.","To establish the recommended configuration via GP, set the following UI path to Enabled: 5 or fewer seconds: Computer Configuration\Policies\Administrative Templates\MSS (Legacy)\MSS: (ScreenSaverGracePeriod) The time in seconds before the screen saver grace period expires (0 recommended). Note: This Group Policy path does not exist by default. An additional Group Policy template (MSS-legacy.admx/adml) is required.",,,,HKEY_LOCAL_MACHINE\SOFTWARE\Microsoft\Windows NT\CurrentVersion\Winlogon,,,passed,,,any
1151260429,26199,cis_win11_enterprise_21H2,Ensure 'MSS: (TcpMaxDataRetransmissions IPv6) How many times unacknowledged data is retransmitted' is set to 'Enabled: 3'.,This setting controls the number of times that TCP retransmits an individual data segment (non-connect segment) before the connection is aborted. The retransmission time-out is doubled with each successive retransmission on a connection. It is reset when responses resume. The base time-out value is dynamically determined by the measured round-trip time on the connection. The recommended state for this setting is: Enabled: 3.,A malicious user could exhaust a target computer's resources if it never sent any acknowledgment messages for data that was transmitted by the target computer.,"To establish the recommended configuration via GP, set the following UI path to Enabled: 3: Computer Configuration\Policies\Administrative Templates\MSS (Legacy)\MSS:(TcpMaxDataRetransmissions IPv6) How many times unacknowledged data is retransmitted. Note: This Group Policy path does not exist by default. An additional Group Policy template (MSS-legacy.admx/adml) is required.",,,,HKEY_LOCAL_MACHINE\SYSTEM\CurrentControlSet\Services\TCPIP6\Parameters,,https://blogs.technet.microsoft.com/secguide/2016/10/02/the-mss-settings/,failed,,,all
1151260429,26200,cis_win11_enterprise_21H2,Ensure 'MSS: (TcpMaxDataRetransmissions) How many times unacknowledged data is retransmitted' is set to 'Enabled: 3'.,This setting controls the number of times that TCP retransmits an individual data segment (non-connect segment) before the connection is aborted. The retransmission time-out is doubled with each successive retransmission on a connection. It is reset when responses resume. The base time-out value is dynamically determined by the measured round-trip time on the connection. The recommended state for this setting is: Enabled: 3.,A malicious user could exhaust a target computer's resources if it never sent any acknowledgment messages for data that was transmitted by the target computer.,"To establish the recommended configuration via GP, set the following UI path to Enabled: 3: Computer Configuration\Policies\Administrative Templates\MSS (Legacy)\MSS:(TcpMaxDataRetransmissions) How many times unacknowledged data is retransmitted. Note: This Group Policy path does not exist by default. An additional Group Policy template (MSS-legacy.admx/adml) is required.",,,,HKEY_LOCAL_MACHINE\SYSTEM\CurrentControlSet\Services\Tcpip\Parameters,,https://blogs.technet.microsoft.com/secguide/2016/10/02/the-mss-settings/,failed,,,all
1151260429,26201,cis_win11_enterprise_21H2,Ensure 'MSS: (WarningLevel) Percentage threshold for the security event log at which the system will generate a warning' is set to 'Enabled: 90% or less'.,"This setting can generate a security audit in the Security event log when the log reaches a user-defined threshold. The recommended state for this setting is: Enabled: 90% or less. Note: If log settings are configured to Overwrite events as needed or Overwrite events older than x days, this event will not be generated.","If the Security log reaches 90 percent of its capacity and the computer has not been configured to overwrite events as needed, more recent events will not be written to the log. If the log reaches its capacity and the computer has been configured to shut down when it can no longer record events to the Security log, the computer will shut down and will no longer be available to provide network services.","To establish the recommended configuration via GP, set the following UI path to Enabled: 90% or less: Computer Configuration\Policies\Administrative Templates\MSS (Legacy)\MSS: (WarningLevel) Percentage threshold for the security event log at which the system will generate a warning. Note: This Group Policy path does not exist by default. An additional Group Policy template (MSS-legacy.admx/adml) is required.",,,,HKEY_LOCAL_MACHINE\SYSTEM\CurrentControlSet\Services\Eventlog\Security,,,passed,,,any
1151260429,26202,cis_win11_enterprise_21H2,Ensure 'Configure DNS over HTTPS (DoH) name resolution' is set to 'Enabled: Allow DoH' or higher.,"This setting determines if DNS over HTTPS (DoH) is used by the system. DNS over HTTPS (DoH) is a protocol for performing remote Domain Name System (DNS) resolution over the Hypertext Transfer Protocol Secure (HTTPS). For additional information on DNS over HTTPS (DoH), visit: Secure DNS Client over HTTPS (DoH) on Windows Server 2022 | Microsoft Docs. The recommended state for this setting is: Enabled: Allow DoH. Configuring this setting to Enabled: Require DoH also conforms to the benchmark.",DNS over HTTPS (DoH) helps protect against DNS spoofing. Spoofing makes a transmission appear to come from a user other than the user who performed the action. It can also help prevent man-in-the-middle (MitM) attacks because the session in-between is encrypted.,"To establish the recommended configuration via GP, set the following UI path to Enabled: Allow DoH (configuring to Enabled: Require DoH also conforms to the benchmark): Computer Configuration\Policies\Administrative Templates\Network\DNS Client\Configure DNS over HTTPS (DoH) name resolution. Note: This Group Policy path may not exist by default. It is provided by the Group Policy template DnsClient.admx/adml that is included with the Microsoft Windows 10 Release 21H2 Administrative Templates (or newer).",,,,HKEY_LOCAL_MACHINE\SOFTWARE\Policies\Microsoft\Windows NT\DNSClient,,,failed,,,all
1151260429,26203,cis_win11_enterprise_21H2,Ensure 'Turn off multicast name resolution' is set to 'Enabled'.,"LLMNR is a secondary name resolution protocol. With LLMNR, queries are sent using multicast over a local network link on a single subnet from a client computer to another client computer on the same subnet that also has LLMNR enabled. LLMNR does not require a DNS server or DNS client configuration, and provides name resolution in scenarios in which conventional DNS name resolution is not possible. The recommended state for this setting is: Enabled.","An attacker can listen on a network for these LLMNR (UDP/5355) or NBT-NS (UDP/137) broadcasts and respond to them, tricking the host into thinking that it knows the location of the requested system. Note: To completely mitigate local name resolution poisoning, in addition to this setting, the properties of each installed NIC should also be set to Disable NetBIOS over TCP/IP (on the WINS tab in the NIC properties). Unfortunately, there is no global setting to achieve this that automatically applies to all NICs - it is a per-NIC setting that varies with different NIC hardware installations.","To establish the recommended configuration via GP, set the following UI path to Enabled: Computer Configuration\Policies\Administrative Templates\Network\DNS Client\Turn off multicast name resolution. Note: This Group Policy path may not exist by default. It is provided by the Group Policy template DnsClient.admx/adml that is included with the Microsoft Windows 8.0 & Server 2012 (non-R2) Administrative Templates (or newer).",,,,HKEY_LOCAL_MACHINE\SOFTWARE\Policies\Microsoft\Windows NT\DNSClient,,,failed,,,all
1151260429,26204,cis_win11_enterprise_21H2,Ensure 'Enable Font Providers' is set to 'Disabled'.,This policy setting determines whether Windows is allowed to download fonts and font catalog data from an online font provider. The recommended state for this setting is: Disabled.,"In an enterprise managed environment the IT department should be managing the changes to the system configuration, to ensure all changes are tested and approved.","To establish the recommended configuration via GP, set the following UI path to Disabled: Computer Configuration\Policies\Administrative Templates\Network\Fonts\Enable Font Providers. Note: This Group Policy path may not exist by default. It is provided by the Group Policy template GroupPolicy.admx/adml that is included with the Microsoft Windows 10 Release 1607 & Server 2016 Administrative Templates (or newer).",,,,HKEY_LOCAL_MACHINE\SOFTWARE\Policies\Microsoft\Windows\System,,,failed,,,all
1151260429,26205,cis_win11_enterprise_21H2,Ensure 'Enable insecure guest logons' is set to 'Disabled'.,This policy setting determines if the SMB client will allow insecure guest logons to an SMB server. The recommended state for this setting is: Disabled.,Insecure guest logons are used by file servers to allow unauthenticated access to shared folders.,"To establish the recommended configuration via GP, set the following UI path to Disabled: Computer Configuration\Policies\Administrative Templates\Network\Lanman Workstation\Enable insecure guest logons. Note: This Group Policy path may not exist by default. It is provided by the Group Policy template LanmanWorkstation.admx/adml that is included with the Microsoft Windows 10 Release 1511 Administrative Templates (or newer).",,,,HKEY_LOCAL_MACHINE\SOFTWARE\Policies\Microsoft\Windows\LanmanWorkstation,,,failed,,,all
1151260429,26206,cis_win11_enterprise_21H2,Ensure 'Turn on Mapper I/O (LLTDIO) driver' is set to 'Disabled'.,This policy setting changes the operational behavior of the Mapper I/O network protocol driver. LLTDIO allows a computer to discover the topology of a network it's connected to. It also allows a computer to initiate Quality-of-Service requests such as bandwidth estimation and network health analysis. The recommended state for this setting is: Disabled.,"To help protect from potentially discovering and connecting to unauthorized devices, this setting should be disabled to prevent responding to network traffic for network topology discovery.","To establish the recommended configuration via GP, set the following UI path to Disabled: Computer Configuration\Policies\Administrative Templates\Network\Link-Layer Topology Discovery\Turn on Mapper I/O (LLTDIO) driver. Note: This Group Policy path is provided by the Group Policy template LinkLayerTopologyDiscovery.admx/adml that is included with all versions of the Microsoft Windows Administrative Templates.",,,,HKEY_LOCAL_MACHINE\SOFTWARE\Policies\Microsoft\Windows\LLTD,,,passed,,,any
1151260429,26207,cis_win11_enterprise_21H2,Ensure 'Turn on Responder (RSPNDR) driver' is set to 'Disabled'.,This policy setting changes the operational behavior of the Responder network protocol driver. The Responder allows a computer to participate in Link Layer Topology Discovery requests so that it can be discovered and located on the network. It also allows a computer to participate in Quality-of-Service activities such as bandwidth estimation and network health analysis. The recommended state for this setting is: Disabled.,"To help protect from potentially discovering and connecting to unauthorized devices, this setting should be disabled to prevent responding to network traffic for network topology discovery.","To establish the recommended configuration via GP, set the following UI path to Disabled: Computer Configuration\Policies\Administrative Templates\Network\Link-Layer Topology Discovery\Turn on Responder (RSPNDR) driver. Note: This Group Policy path is provided by the Group Policy template LinkLayerTopologyDiscovery.admx/adml that is included with all versions of the Microsoft Windows Administrative Templates.",,,,HKEY_LOCAL_MACHINE\SOFTWARE\Policies\Microsoft\Windows\LLTD,,,passed,,,any
1151260429,26208,cis_win11_enterprise_21H2,Ensure 'Turn off Microsoft Peer-to-Peer Networking Services' is set to 'Enabled'.,"The Peer Name Resolution Protocol (PNRP) allows for distributed resolution of a name to an IPv6 address and port number. The protocol operates in the context of clouds. A cloud is a set of peer computers that can communicate with each other by using the same IPv6 scope. Peer-to-Peer protocols allow for applications in the areas of RTC, collaboration, content distribution and distributed processing. The recommended state for this setting is: Enabled.",This setting enhances the security of the environment and reduces the overall risk exposure related to peer-to-peer networking.,"To establish the recommended configuration via GP, set the following UI path to Enabled: Computer Configuration\Policies\Administrative Templates\Network\Microsoft Peer-to-Peer Networking Services\Turn off Microsoft Peer-to-Peer Networking Services. Note: This Group Policy path is provided by the Group Policy template P2P-pnrp.admx/adml that is included with all versions of the Microsoft Windows Administrative Templates.",,,,HKEY_LOCAL_MACHINE\SOFTWARE\Policies\Microsoft\Peernet,,,failed,,,all
