scan_id,id,policy_id,title,description,rationale,remediation,file,process,directory,registry,command,references,result,status,reason,condition
1151260429,26286,cis_win11_enterprise_21H2,Ensure 'Allow Use of Camera' is set to 'Disabled'.,This policy setting controls whether the use of Camera devices on the machine are permitted. The recommended state for this setting is: Disabled.,Cameras in a high security environment can pose serious privacy and data exfiltration risks - they should be disabled to help mitigate that risk.,"To establish the recommended configuration via GP, set the following UI path to Disabled: Computer Configuration\Policies\Administrative Templates\Windows Components\Camera\Allow Use of Camera. Note: This Group Policy path may not exist by default. It is provided by the Group Policy template Camera.admx/adml that is included with the Microsoft Windows 10 Release 1607 & Server 2016 Administrative Templates (or newer).",,,,HKEY_LOCAL_MACHINE\SOFTWARE\Policies\Microsoft\Camera,,,failed,,,all
1151260429,26287,cis_win11_enterprise_21H2,Ensure 'Turn off cloud consumer account state content' is set to 'Enabled'.,This policy setting determines whether cloud consumer account state content is allowed in all Windows experiences. The recommended state for this setting is: Enabled.,The use of consumer accounts in an enterprise managed environment is not good security practice as it could lead to possible data leakage.,"To establish the recommended configuration via GP, set the following UI path to Enabled: Computer Configuration\Policies\Administrative Templates\Windows Components\Cloud Content\Turn off cloud consumer account state content. Note: This Group Policy path may not exist by default. It is provided by the Group Policy template CloudContent.admx/adml that is included with the Microsoft Windows 10 Release 21H2 Administrative Templates (or newer).",,,,HKEY_LOCAL_MACHINE\SOFTWARE\Policies\Microsoft\Windows\CloudContent,,,failed,,,all
1151260429,26288,cis_win11_enterprise_21H2,Ensure 'Turn off cloud optimized content' is set to 'Enabled'.,This policy setting turns off cloud optimized content in all Windows experiences. The recommended state for this setting is: Enabled.,"Due to privacy concerns, data should never be sent to any 3rd party since this data could contain sensitive information.","To establish the recommended configuration via GP, set the following UI path to Enabled: Computer Configuration\Policies\Administrative Templates\Windows Components\Cloud Content\Turn off cloud optimized content. Note: This Group Policy path may not exist by default. It is provided by the Group Policy template CloudContent.admx/adml that is included with the Microsoft Windows 10 Release 20H2 Administrative Templates (or newer).",,,,HKEY_LOCAL_MACHINE\SOFTWARE\Policies\Microsoft\Windows\CloudContent,,,failed,,,all
1151260429,26289,cis_win11_enterprise_21H2,Ensure 'Turn off Microsoft consumer experiences' is set to 'Enabled'.,"This policy setting turns off experiences that help consumers make the most of their devices and Microsoft account. The recommended state for this setting is: Enabled. Note: Per Microsoft TechNet, this policy setting only applies to Windows 10 Enterprise and Windows 10 Education editions.",Having apps silently install in an enterprise managed environment is not good security practice - especially if the apps send data back to a 3rd party.,"To establish the recommended configuration via GP, set the following UI path to Enabled: Computer Configuration\Policies\Administrative Templates\Windows Components\Cloud Content\Turn off Microsoft consumer experiences. Note: This Group Policy path may not exist by default. It is provided by the Group Policy template CloudContent.admx/adml that is included with the Microsoft Windows 10 Release 1511 Administrative Templates (or newer).",,,,HKEY_LOCAL_MACHINE\SOFTWARE\Policies\Microsoft\Windows\CloudContent,,,failed,,,all
1151260429,26290,cis_win11_enterprise_21H2,Ensure 'Require pin for pairing' is set to 'Enabled: First Time' OR 'Enabled: Always'.,This policy setting controls whether or not a PIN is required for pairing to a wireless display device. The recommended state for this setting is: Enabled: First Time OR Enabled: Always.,"If this setting is not configured or disabled then a PIN would not be required when pairing wireless display devices to the system, increasing the risk of unauthorized use.","To establish the recommended configuration via GP, set the following UI path to Enabled: First Time OR Enabled: Always: Computer Configuration\Policies\Administrative Templates\Windows Components\Connect\Require pin for pairing. Note: This Group Policy path may not exist by default. It is provided by the Group Policy template WirelessDisplay.admx/adml that is included with the Microsoft Windows 10 Release 1607 & Server 2016 Administrative Templates (or newer). The new Choose one of the following actions sub-option was later added as of the Windows 10 Release 1809 Administrative Templates. Choosing Enabled in the older templates is the equivalent of choosing Enabled: First Time in the newer templates.",,,,HKEY_LOCAL_MACHINE\SOFTWARE\Policies\Microsoft\Windows\Connect,,,failed,,,all
1151260429,26291,cis_win11_enterprise_21H2,Ensure 'Do not display the password reveal button' is set to 'Enabled'.,This policy setting allows you to configure the display of the password reveal button in password entry user experiences. The recommended state for this setting is: Enabled.,"This is a useful feature when entering a long and complex password, especially when using a touchscreen. The potential risk is that someone else may see your password while surreptitiously observing your screen.","To establish the recommended configuration via GP, set the following UI path to Enabled: Computer Configuration\Policies\Administrative Templates\Windows Components\Credential User Interface\Do not display the password reveal button. Note: This Group Policy path may not exist by default. It is provided by the Group Policy template CredUI.admx/adml that is included with the Microsoft Windows 8.0 & Server 2012 (non-R2) Administrative Templates (or newer).",,,,HKEY_LOCAL_MACHINE\SOFTWARE\Policies\Microsoft\Windows\CredUI,,,failed,,,all
1151260429,26292,cis_win11_enterprise_21H2,Ensure 'Enumerate administrator accounts on elevation' is set to 'Disabled'.,This policy setting controls whether administrator accounts are displayed when a user attempts to elevate a running application. The recommended state for this setting is: Disabled.,"Users could see the list of administrator accounts, making it slightly easier for a malicious user who has logged onto a console session to try to crack the passwords of those accounts.","To establish the recommended configuration via GP, set the following UI path to Disabled: Computer Configuration\Policies\Administrative Templates\Windows Components\Credential User Interface\Enumerate administrator accounts on elevation. Note: This Group Policy path is provided by the Group Policy template CredUI.admx/adml that is included with all versions of the Microsoft Windows Administrative Templates.",,,,HKEY_LOCAL_MACHINE\SOFTWARE\Microsoft\Windows\CurrentVersion\Policies\CredUI,,,passed,,,any
1151260429,26293,cis_win11_enterprise_21H2,Ensure 'Prevent the use of security questions for local accounts' is set to 'Enabled'.,"This policy setting controls whether security questions can be used to reset local account passwords. The security question feature does not apply to domain accounts, only local accounts on the workstation. The recommended state for this setting is: Enabled.","Users could establish security questions that are easily guessed or sleuthed by observing the users social media accounts, making it easier for a malicious actor to change the local user account password and gain access to the computer as that user account.","To establish the recommended configuration via GP, set the following UI path to Enabled: Computer Configuration\Policies\Administrative Templates\Windows Components\Credential User Interface\Prevent the use of security questions for local accounts. Note: This Group Policy path may not exist by default. It is provided by the Group Policy template CredUI.admx/adml that is included with the Microsoft Windows 10 Release 1903 Administrative Templates (or newer).",,,,HKEY_LOCAL_MACHINE\SOFTWARE\Policies\Microsoft\Windows\System,,,failed,,,all
1151260429,26294,cis_win11_enterprise_21H2,Ensure 'Allow Diagnostic Data' is set to 'Enabled: Diagnostic data off (not recommended)' or 'Enabled: Send required diagnostic data'.,"This policy setting determines the amount of diagnostic and usage data reported to Microsoft: - A value of (0) Diagnostic data off (not recommended). Using this value, no diagnostic data is sent from the device. This value is only supported on Enterprise, Education, and Server editions. If you choose this setting, devices in your organization will still be secure. - A value of (1) Send required diagnostic data. This is the minimum diagnostic data necessary to keep Windows secure, up to date, and performing as expected. Using this value disables the Optional diagnostic data control in the Settings app. - A value of (3)Send optional diagnostic data. Additional diagnostic data is collected that helps us to detect, diagnose and fix issues, as well as make product improvements. Required diagnostic data will always be included when you choose to send optional diagnostic data. Optional diagnostic data can also include diagnostic log files and crash dumps. Use the Limit Dump Collection and the Limit  Diagnostic Log Collection policies for more granular control of what optional diagnostic data is sent. Windows telemetry settings apply to the Windows operating system and some first party apps. This setting does not apply to third party apps running on Windows 10/11. The recommended state for this setting is: Enabled: Diagnostic data off (not recommended) or Enabled: Send required diagnostic data. Note: If your organization relies on Windows Update, the minimum recommended setting is Required diagnostic data. Because no Windows Update information is collected when diagnostic data is off, important information about update failures is not sent. Microsoft uses this information to fix the causes of those failures and improve the quality of updates. Note #2: The Configure diagnostic data opt-in settings user interface group policy can be used to prevent end users from changing their data collection settings. Note #3: Enhanced diagnostic data setting is not available on Windows 11 and Windows Server 2022 and has been replaced with policies that can control the amount of optional diagnostic data that is sent. For more information on these settings visit Manage diagnostic data using Group Policy and MDM",Sending any data to a 3rd party vendor is a security concern and should only be done on an as needed basis.,"To establish the recommended configuration via GP, set the following UI path to Enabled: Diagnostic data off (not recommended) or Enabled: Send required diagnostic data: Computer Configuration\Policies\Administrative Templates\Windows Components\Data Collection and Preview Builds\Allow Diagnostic Data. Note: This Group Policy path may not exist by default. It is provided by the Group Policy template DataCollection.admx/adml that is included with the Microsoft Windows 11 Release 21H2 Administrative Templates (or newer). Note #2: In older Microsoft Windows Administrative Templates, this setting was initially named Allow Telemetry, but it was renamed to Allow Diagnostic Data starting with the Windows 11 Release 21H2 Administrative Templates.",,,,HKEY_LOCAL_MACHINE\SOFTWARE\Policies\Microsoft\Windows\DataCollection,,,failed,,,all
1151260429,26295,cis_win11_enterprise_21H2,Ensure 'Configure Authenticated Proxy usage for the Connected User Experience and Telemetry service' is set to 'Enabled: Disable Authenticated Proxy usage'.,This policy setting controls whether the Connected User Experience and Telemetry service can automatically use an authenticated proxy to send data back to Microsoft. The recommended state for this setting is: Enabled: Disable Authenticated Proxy usage.,Sending any data to a 3rd party vendor is a security concern and should only be done on an as needed basis.,"To establish the recommended configuration via GP, set the following UI path to Enabled: Disable Authenticated Proxy usage: Computer Configuration\Policies\Administrative Templates\Windows Components\Data Collection and Preview Builds\Configure Authenticated Proxy usage for the Connected User Experience and Telemetry service. Note: This Group Policy path may not exist by default. It is provided by the Group Policy template DataCollection.admx/adml that is included with the Microsoft Windows 10 Release 1703 Administrative Templates (or newer).",,,,HKEY_LOCAL_MACHINE\SOFTWARE\Policies\Microsoft\Windows\DataCollection,,,failed,,,all
1151260429,26296,cis_win11_enterprise_21H2,Ensure 'Disable OneSettings Downloads' is set to 'Enabled'.,This policy setting controls whether Windows attempts to connect with the OneSettings service to download configuration settings. The recommended state for this setting is: Enabled.,Sending data to a 3rd party vendor is a security concern and should only be done on an as-needed basis.,"To establish the recommended configuration via GP, set the following UI path to Enabled: Computer Configuration\Policies\Administrative Templates\Windows Components\Data Collection and Preview Builds\Disable OneSettings Downloads. Note: This Group Policy path may not exist by default. It is provided by the Group Policy template DataCollection.admx/adml that is included with the Microsoft Windows 10 Release 21H2 Administrative Templates (or newer).",,,,HKEY_LOCAL_MACHINE\SOFTWARE\Policies\Microsoft\Windows\DataCollection,,,failed,,,all
1151260429,26297,cis_win11_enterprise_21H2,Ensure 'Do not show feedback notifications' is set to 'Enabled'.,This policy setting allows an organization to prevent its devices from showing feedback questions from Microsoft. The recommended state for this setting is: Enabled.,Users should not be sending any feedback to 3rd party vendors in an enterprise managed environment.,"To establish the recommended configuration via GP, set the following UI path to Enabled: Computer Configuration\Policies\Administrative Templates\Windows Components\Data Collection and Preview Builds\Do not show feedback notifications. Note: This Group Policy path may not exist by default. It is provided by the Group Policy template FeedbackNotifications.admx/adml that is included with the Microsoft Windows 10 Release 1511 Administrative Templates (or newer).",,,,HKEY_LOCAL_MACHINE\SOFTWARE\Policies\Microsoft\Windows\DataCollection,,,failed,,,all
1151260429,26298,cis_win11_enterprise_21H2,Ensure 'Enable OneSettings Auditing' is set to 'Enabled'.,This policy setting controls whether Windows records attempts to connect with the OneSettings service to the Operational EventLog. The recommended state for this setting is: Enabled.,If events are not recorded it may be difficult or impossible to determine the root cause of system problems or the unauthorized activities of malicious users.,"To establish the recommended configuration via GP, set the following UI path to Enabled: Computer Configuration\Policies\Administrative Templates\Windows Components\Data Collection and Preview Builds\Enable OneSettings Auditing. Note: This Group Policy path may not exist by default. It is provided by the Group Policy template DataCollection.admx/adml that is included with the Microsoft Windows 10 Release 21H2 Administrative Templates (or newer).",,,,HKEY_LOCAL_MACHINE\SOFTWARE\Policies\Microsoft\Windows\DataCollection,,,failed,,,all
1151260429,26299,cis_win11_enterprise_21H2,Ensure 'Limit Diagnostic Log Collection' is set to 'Enabled'.,This policy setting controls whether additional diagnostic logs are collected when more information is needed to troubleshoot a problem on the device. The recommended state for this setting is: Enabled. Note: Diagnostic logs are only sent when the device has been configured to send optional diagnostic data. Diagnostic data is limited with recommendation Allow Diagnostic Data is set to Enabled: Diagnostic data off (not recommended) or Enabled: Send required diagnostic data to send only basic information.,Sending data to a 3rd-party vendor is a security concern and should only be done on an as-needed basis.,"To establish the recommended configuration via GP, set the following UI path to Enabled: Computer Configuration\Policies\Administrative Templates\Windows Components\Data Collection and Preview Builds\Limit Diagnostic Log Collection. Note: This Group Policy path may not exist by default. It is provided by the Group Policy template DataCollection.admx/adml that is included with the Microsoft Windows 10 Release 21H2 Administrative Templates (or newer).",,,,HKEY_LOCAL_MACHINE\SOFTWARE\Policies\Microsoft\Windows\DataCollection,,,failed,,,all
1151260429,26300,cis_win11_enterprise_21H2,Ensure 'Limit Dump Collection' is set to 'Enabled'.,This policy setting limits the type of dumps that can be collected when more information is needed to troubleshoot a problem. The recommended state for this setting is: Enabled. Note: Dumps are only sent when the device has been configured to send optional diagnostic data. Diagnostic data is limited with recommendation Ensure Allow Diagnostic Data is set to Enabled: Diagnostic data off (not recommended) or Enabled: Send required diagnostic data to send only basic information.,Sending data to a 3rd party vendor is a security concern and should only be done on an as needed basis.,"To establish the recommended configuration via GP, set the following UI path to Enabled. Computer Configuration\Policies\Administrative Templates\Windows Components\Data Collection and Preview Builds\Limit Dump Collection. Note: This Group Policy path may not exist by default. It is provided by the Group Policy template DataCollection.admx/adml that is included with the Microsoft Windows 10 Release 21H2 Administrative Templates (or newer).",,,,HKEY_LOCAL_MACHINE\SOFTWARE\Policies\Microsoft\Windows\DataCollection,,,failed,,,all
1151260429,26301,cis_win11_enterprise_21H2,Ensure 'Toggle user control over Insider builds' is set to 'Disabled'.,"This policy setting determines whether users can access the Insider build controls in the Advanced Options for Windows Update. These controls are located under ""Get Insider builds,"" and enable users to make their devices available for downloading and installing Windows preview software. The recommended state for this setting is: Disabled. Note: This policy setting applies only to devices running Windows 10 Pro or Windows 10 Enterprise, up until Release 1703. For Release 1709 or newer, Microsoft encourages using the Manage preview builds setting (recommendation title Manage preview builds). We have kept this setting in the benchmark to ensure that any older builds of Windows 10 in the environment are still enforced.","It can be risky for experimental features to be allowed in an enterprise managed environment because this can introduce bugs and security holes into systems, making it easier for an attacker to gain access. It is generally preferred to only use production-ready builds.","To establish the recommended configuration via GP, set the following UI path to Disabled: Computer Configuration\Policies\Administrative Templates\Windows Components\Data Collection and Preview Builds\Toggle user control over Insider builds. Note: This Group Policy path may not exist by default. It is provided by the Group Policy template AllowBuildPreview.admx/adml that is included with the Microsoft Windows 10 RTM (Release 1507) Administrative Templates (or newer).",,,,HKEY_LOCAL_MACHINE\SOFTWARE\Policies\Microsoft\Windows\PreviewBuilds,,,failed,,,all
1151260429,26302,cis_win11_enterprise_21H2,Ensure 'Download Mode' is NOT set to 'Enabled: Internet'.,"This policy setting specifies the download method that Delivery Optimization can use in downloads of Windows Updates, Apps and App updates. The following methods are supported: - 0 = HTTP only, no peering. - 1 = HTTP blended with peering behind the same NAT. - 2 = HTTP blended with peering across a private group. Peering occurs on devices in the same Active Directory Site (if exist) or the same domain by default. When this option is selected, peering will cross NATs. To create a custom group use Group ID in combination with Mode 2. - 3 = HTTP blended with Internet Peering. - 99 = Simple download mode with no peering. Delivery Optimization downloads using HTTP only and does not attempt to contact the Delivery Optimization cloud services. - 100 = Bypass mode. Do not use Delivery Optimization and use BITS instead. The recommended state for this setting is any value EXCEPT: Enabled: Internet (3). Note: The default on all SKUs other than Enterprise, Enterprise LTSB or Education is Enabled: Internet (3), so on other SKUs, be sure to set this to a different value.","Due to privacy concerns and security risks, updates should only be downloaded directly from Microsoft, or from a trusted machine on the internal network that received its updates from a trusted source and approved by the network administrator.","To establish the recommended configuration via GP, set the following UI path to any value other than Enabled: Internet (3): Computer Configuration\Policies\Administrative Templates\Windows Components\Delivery Optimization\Download Mode. Note: This Group Policy path may not exist by default. It is provided by the Group Policy template DeliveryOptimization.admx/adml that is included with the Microsoft Windows 10 RTM (Release 1507) Administrative Templates (or newer).",,,,HKEY_LOCAL_MACHINE\SOFTWARE\Policies\Microsoft\Windows\DeliveryOptimization,,,,Not applicable,Unable to read registry 'HKEY_LOCAL_MACHINE\SOFTWARE\Policies\Microsoft\Windows\DeliveryOptimization' (The system cannot find the file specified. ),all
1151260429,26303,cis_win11_enterprise_21H2,Ensure 'Application: Control Event Log behavior when the log file reaches its maximum size' is set to 'Disabled'.,This policy setting controls Event Log behavior when the log file reaches its maximum size. The recommended state for this setting is: Disabled. Note: Old events may or may not be retained according to the Backup log automatically when full policy setting.,If new events are not recorded it may be difficult or impossible to determine the root cause of system problems or the unauthorized activities of malicious users.,"To establish the recommended configuration via GP, set the following UI path to Disabled: Computer Configuration\Policies\Administrative Templates\Windows Components\Event Log Service\Application\Control Event Log behavior when the log file reaches its maximum size. Note: This Group Policy path is provided by the Group Policy template EventLog.admx/adml that is included with all versions of the Microsoft Windows Administrative Templates. Note #2: In older Microsoft Windows Administrative Templates, this setting was initially named Retain old events, but it was renamed starting with the Windows 8.0 & Server 2012 (non-R2) Administrative Templates.",,,,HKEY_LOCAL_MACHINE\SOFTWARE\Policies\Microsoft\Windows\EventLog\Application,,,passed,,,any
1151260429,26304,cis_win11_enterprise_21H2,"Ensure 'Application: Specify the maximum log file size (KB)' is set to 'Enabled: 32,768 or greater'.","This policy setting specifies the maximum size of the log file in kilobytes. The maximum log file size can be configured between 1 megabyte (1,024 kilobytes) and 4 terabytes (4,194,240 kilobytes) in kilobyte increments. The recommended state for this setting is: Enabled: 32,768 or greater.",If events are not recorded it may be difficult or impossible to determine the root cause of system problems or the unauthorized activities of malicious users.,"To establish the recommended configuration via GP, set the following UI path to Enabled: 32,768 or greater: Computer Configuration\Policies\Administrative Templates\Windows Components\Event Log Service\Application\Specify the maximum log file size (KB). Note: This Group Policy path is provided by the Group Policy template EventLog.admx/adml that is included with all versions of the Microsoft Windows Administrative Templates. Note #2: In older Microsoft Windows Administrative Templates, this setting was initially named Maximum Log Size (KB), but it was renamed starting with the Windows 8.0 & Server 2012 (non-R2) Administrative Templates.",,,,HKEY_LOCAL_MACHINE\SOFTWARE\Policies\Microsoft\Windows\EventLog\Application,,,failed,,,all
