scan_id,id,policy_id,title,description,rationale,remediation,file,process,directory,registry,command,references,result,status,reason,condition
1151260429,26000,cis_win11_enterprise_21H2,Ensure 'Enforce password history' is set to '24 or more password(s)'.,"This policy setting determines the number of renewed, unique passwords that have to be associated with a user account before you can reuse an old password. The value for this policy setting must be between 0 and 24 passwords. The default value for Windows Vista is 0 passwords, but the default setting in a domain is 24 passwords. To maintain the effectiveness of this policy setting, use the Minimum password age setting to prevent users from repeatedly changing their password. The recommended state for this setting is: 24 or more password(s). Note: Password Policy settings (section 1.1) and Account Lockout Policy settings (section 1.2) must be applied via the Default Domain Policy GPO in order to be globally in effect on domain user accounts as their default behavior. If these settings are configured in another GPO, they will only affect local user accounts on the computers that receive the GPO. However, custom exceptions to the default password policy and account lockout policy rules for specific domain users and/or groups can be defined using Password Settings Objects (PSOs), which are completely separate from Group Policy and most easily configured using Active Directory Administrative Center. Note #2: As of the publication of this benchmark, Microsoft currently has a maximum limit of 24 saved passwords. For more information, please visit Enforce password history (Windows 10) - Windows security | Microsoft Docs","The longer a user uses the same password, the greater the chance that an attacker can determine the password through brute force attacks. Also, any accounts that may have been compromised will remain exploitable for as long as the password is left unchanged. If password changes are required but password reuse is not prevented, or if users continually reuse a small number of passwords, the effectiveness of a good password policy is greatly reduced. If you specify a low number for this policy setting, users will be able to use the same small number of passwords repeatedly. If you do not also configure the Minimum password age setting, users might repeatedly change their passwords until they can reuse their original password.","To establish the recommended configuration via GP, set the following UI path to 24 or more password(s): Computer Configuration\Policies\Windows Settings\Security Settings\Account Policies\Password Policy\Enforce password history",,,,,net.exe accounts,,failed,,,all
1151260429,26001,cis_win11_enterprise_21H2,"Ensure 'Maximum password age' is set to '365 or fewer days, but not 0'.","This policy setting defines how long a user can use their password before it expires. Values for this policy setting range from 0 to 999 days. If you set the value to 0, the password will never expire. Because attackers can crack passwords, the more frequently you change the password the less opportunity an attacker has to use a cracked password. However, the lower this value is set, the higher the potential for an increase in calls to help desk support due to users having to change their password or forgetting which password is current. The recommended state for this setting is 365 or fewer days, but not 0. Note: Password Policy settings (section 1.1) and Account Lockout Policy settings (section 1.2) must be applied via the Default Domain Policy GPO in order to be globally in effect on domain user accounts as their default behavior. If these settings are configured in another GPO, they will only affect local user accounts on the computers that receive the GPO. However, custom exceptions to the default password policy and account lockout policy rules for specific domain users and/or groups can be defined using Password Settings Objects (PSOs), which are completely separate from Group Policy and most easily configured using Active Directory Administrative Center.","The longer a password exists the higher the likelihood that it will be compromised by a brute force attack, by an attacker gaining general knowledge about the user, or by the user sharing the password. Configuring the Maximum password age setting to 0 so that users are never required to change their passwords is a major security risk because that allows a compromised password to be used by the malicious user for as long as the valid user has authorized access.","To establish the recommended configuration via GP, set the following UI path to 365 or fewer days, but not 0: Computer Configuration\Policies\Windows Settings\Security Settings\Account Policies\Password Policy\Maximum password age",,,,,net.exe accounts,,passed,,,all
1151260429,26002,cis_win11_enterprise_21H2,Ensure 'Minimum password age' is set to '1 or more day(s)'.,"This policy setting determines the number of days that you must use a password before you can change it. The range of values for this policy setting is between 1 and 999 days. (You may also set the value to 0 to allow immediate password changes.) The default value for this setting is 0 days. The recommended state for this setting is: 1 or more day(s)). Note: Password Policy settings (section 1.1) and Account Lockout Policy settings (section 1.2) must be applied via the Default Domain Policy GPO in order to be globally in effect on domain user accounts as their default behavior. If these settings are configured in another GPO, they will only affect local user accounts on the computers that receive the GPO. However, custom exceptions to the default password policy and account lockout policy rules for specific domain users and/or groups can be defined using Password Settings Objects (PSOs), which are completely separate from Group Policy and most easily configured using Active Directory Administrative Center.","Users may have favorite passwords that they like to use because they are easy to remember and they believe that their password choice is secure from compromise. Unfortunately, passwords are compromised and if an attacker is targeting a specific individual's user account, with foreknowledge of data about that user, reuse of old passwords can cause a security breach. To address password reuse a combination of security settings is required. Using this policy setting with the Enforce password history setting prevents the easy reuse of old passwords. For example, if you configure the Enforce password history setting to ensure that users cannot reuse any of their last 12 passwords, they could change their password 13 times in a few minutes and reuse the password they started with, unless you also configure the Minimum password age setting to a number that is greater than 0. You must configure this policy setting to a number that is greater than 0 for the Enforce password history setting to be effective.","To establish the recommended configuration via GP, set the following UI path to 1 or more day(s): Computer Configuration\Policies\Windows Settings\Security Settings\Account Policies\Password Policy\Minimum password age",,,,,net.exe accounts,,failed,,,all
1151260429,26003,cis_win11_enterprise_21H2,Ensure 'Minimum password length' is set to '14 or more character(s)'.,"This policy setting determines the least number of characters that make up a password for a user account. There are many different theories about how to determine the best password length for an organization, but perhaps 'passphrase' is a better term than 'password.' In Microsoft Windows 2000 and newer, passphrases can be quite long and can include spaces. Therefore, a phrase such as 'I want to drink a $5 milkshake' is a valid passphrase; it is a considerably stronger password than an 8 or 10 character string of random numbers and letters, and yet is easier to remember. Users must be educated about the proper selection and maintenance of passwords, especially with regard to password length. In enterprise environments, the ideal value for the Minimum password length setting is 14 characters, however you should adjust this value to meet your organization's business requirements. The recommended state for this setting is: 14 or more character(s). Note: In Windows Server 2016 and older versions of Windows Server, the GUI of the Local Security Policy (LSP), Local Group Policy Editor (LGPE) and Group Policy Management Editor (GPME) would not let you set this value higher than 14 characters. However, starting with Windows Server 2019, Microsoft changed the GUI to allow up to a 20 character minimum password length. Note #2: Password Policy settings (section 1.1) and Account Lockout Policy settings (section 1.2) must be applied via the Default Domain Policy GPO in order to be globally in effect on domain user accounts as their default behavior. If these settings are configured in another GPO, they will only affect local user accounts on the computers that receive the GPO. However, custom exceptions to the default password policy and account lockout policy rules for specific domain users and/or groups can be defined using Password Settings Objects (PSOs), which are completely separate from Group Policy and most easily configured using Active Directory Administrative Center.","Types of password attacks include dictionary attacks (which attempt to use common words and phrases) and brute force attacks (which try every possible combination of characters). Also, attackers sometimes try to obtain the account database so they can use tools to discover the accounts and passwords.","To establish the recommended configuration via GP, set the following UI path to 14 or more character(s): Computer Configuration\Policies\Windows Settings\Security Settings\Account Policies\Password Policy\Minimum password length",,,,,net.exe accounts,,failed,,,all
1151260429,26004,cis_win11_enterprise_21H2,Ensure 'Password must meet complexity requirements' is set to 'Enabled'.,"This policy setting checks all new passwords to ensure that they meet basic requirements for strong passwords. When this policy is enabled, passwords must meet the following minimum requirements: - Not contain the user's account name or parts of the user's full name that exceed two consecutive characters - Be at least six characters in length - Contain characters from three of the following categories: - English uppercase characters (A through Z) - English lowercase characters (a through z) - Base 10 digits (0 through 9) - Non-alphabetic characters (for example, !, $, #, %) o A catch-all category of any Unicode character that does not fall under the    previous four categories. This fifth category can be regionally specific. Each additional character in a password increases its complexity exponentially. For instance, a seven-character, all lower-case alphabetic password would have 267 (approximately 8 x 109 or 8 billion) possible combinations. At 1,000,000 attempts per second (a capability of many password-cracking utilities), it would only take 133 minutes to crack. A seven-character alphabetic password with case sensitivity has 527 combinations. A seven-character case-sensitive alphanumeric password without punctuation has 627 combinations. An eight-character password has 268 (or 2 x 1011) possible combinations. Although this might seem to be a large number, at 1,000,000 attempts per second it would take only 59 hours to try all possible passwords. Remember, these times will significantly increase for passwords that use ALT characters and other special keyboard characters such as '!'' or '@''. Proper use of the password settings can help make it difficult to mount a brute force attack. The recommended state for this setting is: Enabled. Note: Password Policy settings (section 1.1) and Account Lockout Policy settings (section 1.2) must be applied via the Default Domain Policy GPO in order to be globally in effect on domain user accounts as their default behavior. If these settings are configured in another GPO, they will only affect local user accounts on the computers that receive the GPO. However, custom exceptions to the default password policy and account lockout policy rules for specific domain users and/or groups can be defined using Password Settings Objects (PSOs), which are completely separate from Group Policy and most easily configured using Active Directory Administrative Center.",Passwords that contain only alphanumeric characters are extremely easy to discover with several publicly available tools.,"To establish the recommended configuration via GP, set the following UI path to Enabled: Computer Configuration\Policies\Windows Settings\Security Settings\Account Policies\Password Policy\Password must meet complexity requirements",,,,,powershell Get-ADDefaultDomainPasswordPolicy -Current LoggedOnUser,,failed,,,all
1151260429,26005,cis_win11_enterprise_21H2,Ensure 'Relax minimum password length limits' is set to 'Enabled'.,"This policy setting determines whether the minimum password length setting can be increased beyond the legacy limit of 14 characters. For more information please see the following Microsoft Security Blog. The recommended state for this setting is: Enabled. Note: This setting only affects local accounts on the computer. Domain accounts are only affected by settings on the Domain Controllers, because that is where domain accounts are stored.",This setting will enable the enforcement of longer and generally stronger passwords or passphrases where MFA is not in use.,"To establish the recommended configuration via GP, set the following UI path to Enabled: Computer Configuration\Policies\Windows Settings\Security Settings\Account Policies\Password Policy\Relax minimum password length limits. Note: This setting is only available within the built-in OS security template of Windows 10 Release 2004 and Server 2022 (or newer), and is not available via older versions of the OS, or via downloadable Administrative Templates (ADMX/ADML). Therefore, you must use a Windows 10 Release 2004 or Server 2022 system (or newer) to view or edit this setting with the Group Policy Management Console (GPMC) or Group Policy Management Editor (GPME).",,,,HKEY_LOCAL_MACHINE\System\CurrentControlSet\Control\SAM,,,failed,,,all
1151260429,26006,cis_win11_enterprise_21H2,Ensure 'Account lockout duration' is set to '15 or more minute(s)'.,"This policy setting determines the length of time that must pass before a locked account is unlocked and a user can try to log on again. The setting does this by specifying the number of minutes a locked out account will remain unavailable. If the value for this policy setting is configured to 0, locked out accounts will remain locked out until an administrator manually unlocks them. Although it might seem like a good idea to configure the value for this policy setting to a high value, such a configuration will likely increase the number of calls that the help desk receives to unlock accounts locked by mistake. Users should be aware of the length of time a lock remains in place, so that they realize they only need to call the help desk if they have an extremely urgent need to regain access to their computer. The recommended state for this setting is: 15 or more minute(s). Note: Password Policy settings (section 1.1) and Account Lockout Policy settings (section 1.2) must be applied via the Default Domain Policy GPO in order to be globally in effect on domain user accounts as their default behavior. If these settings are configured in another GPO, they will only affect local user accounts on the computers that receive the GPO. However, custom exceptions to the default password policy and account lockout policy rules for specific domain users and/or groups can be defined using Password Settings Objects (PSOs), which are completely separate from Group Policy and most easily configured using Active Directory Administrative Center.","A denial of service (DoS) condition can be created if an attacker abuses the Account lockout threshold and repeatedly attempts to log on with a specific account. Once you configure the Account lockout threshold setting, the account will be locked out after the specified number of failed attempts. If you configure the Account lockout duration setting to 0, then the account will remain locked out until an administrator unlocks it manually.","To establish the recommended configuration via GP, set the following UI path to 15 or more minute(s): Computer Configuration\Policies\Windows Settings\Security Settings\Account Policies\Account Lockout Policy\Account lockout duration",,,,,net.exe accounts,,passed,,,all
1151260429,26007,cis_win11_enterprise_21H2,"Ensure 'Account lockout threshold' is set to '5 or fewer invalid logon attempt(s), but not 0'.","This policy setting determines the number of failed logon attempts before the account is locked. Setting this policy to 0 does not conform to the benchmark as doing so disables the account lockout threshold. The recommended state for this setting is: 5 or fewer invalid logon attempt(s), but not 0. Note: Password Policy settings (section 1.1) and Account Lockout Policy settings (section 1.2) must be applied via the Default Domain Policy GPO in order to be globally in effect on domain user accounts as their default behavior. If these settings are configured in another GPO, they will only affect local user accounts on the computers that receive the GPO. However, custom exceptions to the default password policy and account lockout policy rules for specific domain users and/or groups can be defined using Password Settings Objects (PSOs), which are completely separate from Group Policy and most easily configured using Active Directory Administrative Center.",Setting an account lockout threshold reduces the likelihood that an online password brute force attack will be successful. Setting the account lockout threshold too low introduces risk of increased accidental lockouts and/or a malicious actor intentionally locking out accounts.,"To establish the recommended configuration via GP, set the following UI path to 5 or fewer invalid login attempt(s), but not 0: Computer Configuration\Policies\Windows Settings\Security Settings\Account Policies\Account Lockout Policy\Account lockout threshold",,,,,net.exe accounts,,failed,,,all
1151260429,26008,cis_win11_enterprise_21H2,Ensure 'Reset account lockout counter after' is set to '15 or more minute(s)'.,"This policy setting determines the length of time before the Account lockout threshold resets to zero. The default value for this policy setting is Not Defined. If the Account lockout threshold is defined, this reset time must be less than or equal to the value for the Account lockout duration setting. If you leave this policy setting at its default value or configure the value to an interval that is too long, your environment could be vulnerable to a DoS attack. An attacker could maliciously perform a number of failed logon attempts on all users in the organization, which will lock out their accounts. If no policy were determined to reset the account lockout, it would be a manual task for administrators. Conversely, if a reasonable time value is configured for this policy setting, users would be locked out for a set period until all of the accounts are unlocked automatically. The recommended state for this setting is: 15 or more minute(s). Note: Password Policy settings (section 1.1) and Account Lockout Policy settings (section 1.2) must be applied via the Default Domain Policy GPO in order to be globally in effect on domain user accounts as their default behavior. If these settings are configured in another GPO, they will only affect local user accounts on the computers that receive the GPO. However, custom exceptions to the default password policy and account lockout policy rules for specific domain users and/or groups can be defined using Password Settings Objects (PSOs), which are completely separate from Group Policy and most easily configured using Active Directory Administrative Center.","Users can accidentally lock themselves out of their accounts if they mistype their password multiple times. To reduce the chance of such accidental lockouts, the Reset account lockout counter after setting determines the number of minutes that must elapse before the counter that tracks failed logon attempts and triggers lockouts is reset to 0.","To establish the recommended configuration via GP, set the following UI path to 15 or more minute(s): Computer Configuration\Policies\Windows Settings\Security Settings\Account Policies\Account Lockout Policy\Reset account lockout counter after",,,,,net.exe accounts,,passed,,,all
1151260429,26009,cis_win11_enterprise_21H2,Ensure 'Accounts: Administrator account status' is set to 'Disabled'.,"This policy setting enables or disables the Administrator account during normal operation. When a computer is booted into safe mode, the Administrator account is always enabled, regardless of how this setting is configured. Note that this setting will have no impact when applied to the Domain Controllers organizational unit via group policy because Domain Controllers have no local account database. It can be configured at the domain level via group policy, similar to account lockout and password policy settings. The recommended state for this setting is: Disabled.","In some organizations, it can be a daunting management challenge to maintain a regular schedule for periodic password changes for local accounts. Therefore, you may want to disable the built-in Administrator account instead of relying on regular password changes to protect it from attack. Another reason to disable this built-in account is that it cannot be locked out no matter how many failed logons it accrues, which makes it a prime target for brute force attacks that attempt to guess passwords. Also, this account has a well-known security identifier (SID) and there are third-party tools that allow authentication by using the SID rather than the account name. This capability means that even if you rename the Administrator account, an attacker could launch a brute force attack by using the SID to log on.","To establish the recommended configuration via GP, set the following UI path to Disabled: Computer Configuration\Policies\Windows Settings\Security Settings\Local Policies\Security Options\Accounts: Administrator account status",,,,,net user administrator,,passed,,,any
1151260429,26010,cis_win11_enterprise_21H2,Ensure 'Accounts: Block Microsoft accounts' is set to 'Users can't add or log on with Microsoft accounts'.,This policy setting prevents users from adding new Microsoft accounts on this computer. The recommended state for this setting is: Users can't add or log on with Microsoft accounts.,Organizations that want to effectively implement identity management policies and maintain firm control of what accounts are used to log onto their computers will probably want to block Microsoft accounts. Organizations may also need to block Microsoft accounts in order to meet the requirements of compliance standards that apply to their information systems.,"To establish the recommended configuration via GP, set the following UI path to Users can't add or log on with Microsoft accounts: Computer Configuration\Policies\Windows Settings\Security Settings\Local Policies\Security Options\Accounts: Block Microsoft accounts",,,,HKEY_LOCAL_MACHINE\Software\Microsoft\Windows\CurrentVersion\Policies\System,,,failed,,,all
1151260429,26011,cis_win11_enterprise_21H2,Ensure 'Accounts: Guest account status' is set to 'Disabled'.,"This policy setting determines whether the Guest account is enabled or disabled. The Guest account allows unauthenticated network users to gain access to the system. The recommended state for this setting is: Disabled. Note: This setting will have no impact when applied to the Domain Controllers organizational unit via group policy because Domain Controllers have no local account database. It can be configured at the domain level via group policy, similar to account lockout and password policy settings.","The default Guest account allows unauthenticated network users to log on as Guest with no password. These unauthorized users could access any resources that are accessible to the Guest account over the network. This capability means that any network shares with permissions that allow access to the Guest account, the Guests group, or the Everyone group will be accessible over the network, which could lead to the exposure or corruption of data.","To establish the recommended configuration via GP, set the following UI path to Disabled: Computer Configuration\Policies\Windows Settings\Security Settings\Local Policies\Security Options\Accounts: Guest account status",,,,,net user guest,,passed,,,all
