scan_id,id,policy_id,title,description,rationale,remediation,file,process,directory,registry,command,references,result,status,reason,condition
1151260429,26084,cis_win11_enterprise_21H2,Ensure 'Microsoft FTP Service (FTPSVC)' is set to 'Disabled' or 'Not Installed'.,"Enables the server to be a File Transfer Protocol (FTP) server. The recommended state for this setting is: Disabled or Not Installed. Note: This service is not installed by default. It is supplied with Windows, but is installed by enabling an optional Windows feature (Internet Information Services - FTP Server).","Hosting an FTP server (especially a non-secure FTP server) from a workstation is an increased security risk, as the attack surface of that workstation is then greatly increased. Note: This security concern applies to any FTP server application installed on a workstation, not just IIS.","To establish the recommended configuration via GP, set the following UI path to: Disabled or ensure the service is not installed. Computer Configuration\Policies\Windows Settings\Security Settings\System Services\Microsoft FTP Service",,,,HKEY_LOCAL_MACHINE\SYSTEM\CurrentControlSet\Services\FTPSVC,,,passed,,,any
1151260429,26085,cis_win11_enterprise_21H2,Ensure 'Microsoft iSCSI Initiator Service (MSiSCSI)' is set to 'Disabled'.,Manages Internet SCSI (iSCSI) sessions from this computer to remote target devices. The recommended state for this setting is: Disabled.,"This service is critically necessary in order to directly attach to an iSCSI device. However, iSCSI itself uses a very weak authentication protocol (CHAP), which means that the passwords for iSCSI communication are easily exposed, unless all of the traffic is isolated and/or encrypted using another technology like IPsec. This service is generally more appropriate for servers in a controlled environment then on workstations requiring high security.","To establish the recommended configuration via GP, set the following UI path to: Disabled. Computer Configuration\Policies\Windows Settings\Security Settings\System Services\Microsoft iSCSI Initiator Service",,,,HKEY_LOCAL_MACHINE\SYSTEM\CurrentControlSet\Services\MSiSCSI,,,failed,,,all
1151260429,26086,cis_win11_enterprise_21H2,Ensure 'OpenSSH SSH Server (sshd)' is set to 'Disabled' or 'Not Installed'.,"SSH protocol based service to provide secure encrypted communications between two untrusted hosts over an insecure network. The recommended state for this setting is: Disabled or Not Installed. Note: This service is not installed by default. It is supplied with Windows, but it is installed by enabling an optional Windows feature (OpenSSH Server).","Hosting an SSH server from a workstation is an increased security risk, as the attack surface of that workstation is then greatly increased. Note: This security concern applies to any SSH server application installed on a workstation, not just the one supplied with Windows.","To establish the recommended configuration via GP, set the following UI path to: Disabled or ensure the service is not installed. Computer Configuration\Policies\Windows Settings\Security Settings\System Services\OpenSSH SSH Server",,,,HKEY_LOCAL_MACHINE\SYSTEM\CurrentControlSet\Services\sshd,,,passed,,,any
1151260429,26087,cis_win11_enterprise_21H2,Ensure 'Peer Name Resolution Protocol (PNRPsvc)' is set to 'Disabled'.,Enables serverless peer name resolution over the Internet using the Peer Name Resolution Protocol (PNRP). The recommended state for this setting is: Disabled.,"Peer Name Resolution Protocol is a distributed and (mostly) serverless way to handle name resolution of clients with each other. In a high security environment, it is more secure to rely on centralized name resolution methods maintained by authorized staff.","To establish the recommended configuration via GP, set the following UI path to: Disabled. Computer Configuration\Policies\Windows Settings\Security Settings\System Services\Peer Name Resolution Protocol",,,,HKEY_LOCAL_MACHINE\SYSTEM\CurrentControlSet\Services\PNRPsvc,,,failed,,,all
1151260429,26088,cis_win11_enterprise_21H2,Ensure 'Peer Networking Grouping (p2psvc)' is set to 'Disabled'.,Enables multi-party communication using Peer-to-Peer Grouping. The recommended state for this setting is: Disabled.,"Peer Name Resolution Protocol is a distributed and (mostly) serverless way to handle name resolution of clients with each other. In a high security environment, it is more secure to rely on centralized name resolution methods maintained by authorized staff.","To establish the recommended configuration via GP, set the following UI path to: Disabled. Computer Configuration\Policies\Windows Settings\Security Settings\System Services\Peer Networking Grouping",,,,HKEY_LOCAL_MACHINE\SYSTEM\CurrentControlSet\Services\p2psvc,,,failed,,,all
1151260429,26089,cis_win11_enterprise_21H2,Ensure 'Peer Networking Identity Manager (p2pimsvc)' is set to 'Disabled'.,Provides identity services for the Peer Name Resolution Protocol (PNRP) and Peer-to-Peer Grouping services. The recommended state for this setting is: Disabled.,"Peer Name Resolution Protocol is a distributed and (mostly) serverless way to handle name resolution of clients with each other. In a high security environment, it is more secure to rely on centralized name resolution methods maintained by authorized staff.","To establish the recommended configuration via GP, set the following UI path to: Disabled. Computer Configuration\Policies\Windows Settings\Security Settings\System Services\Peer Networking Identity Manager",,,,HKEY_LOCAL_MACHINE\SYSTEM\CurrentControlSet\Services\p2pimsvc,,,failed,,,all
1151260429,26090,cis_win11_enterprise_21H2,Ensure 'PNRP Machine Name Publication Service (PNRPAutoReg)' is set to 'Disabled'.,This service publishes a machine name using the Peer Name Resolution Protocol. Configuration is managed via the netsh context p2p pnrp peer. The recommended state for this setting is: Disabled.,"Peer Name Resolution Protocol is a distributed and (mostly) serverless way to handle name resolution of clients with each other. In a high security environment, it is more secure to rely on centralized name resolution methods maintained by authorized staff.","To establish the recommended configuration via GP, set the following UI path to: Disabled. Computer Configuration\Policies\Windows Settings\Security Settings\System Services\PNRP Machine Name Publication Service",,,,HKEY_LOCAL_MACHINE\SYSTEM\CurrentControlSet\Services\PNRPAutoReg,,,failed,,,all
1151260429,26091,cis_win11_enterprise_21H2,Ensure 'Print Spooler (Spooler)' is set to 'Disabled'.,This service spools print jobs and handles interaction with printers. The recommended state for this setting is: Disabled.,"In a high security environment, unnecessary services especially those with known vulnerabilities should be disabled. Disabling the Print Spooler (Spooler) service mitigates the PrintNightmare vulnerability (CVE-2021-34527) and other attacks against the service.","To establish the recommended configuration via GP, set the following UI path to: Disabled: Computer Configuration\Policies\Windows Settings\Security Settings\System Services\Print Spooler",,,,HKEY_LOCAL_MACHINE\SYSTEM\CurrentControlSet\Services\Spooler,,,failed,,,all
1151260429,26092,cis_win11_enterprise_21H2,Ensure 'Problem Reports and Solutions Control Panel Support (wercplsupport)' is set to 'Disabled'.,"This service provides support for viewing, sending and deletion of system-level problem reports for the Problem Reports and Solutions control panel. The recommended state for this setting is: Disabled.","This service is involved in the process of displaying/reporting issues & solutions to/from Microsoft. In a high security environment, preventing this information from being sent can help reduce privacy concerns for sensitive corporate information.","To establish the recommended configuration via GP, set the following UI path to: Disabled. Computer Configuration\Policies\Windows Settings\Security Settings\System Services\Problem Reports and Solutions Control Panel Support",,,,HKEY_LOCAL_MACHINE\SYSTEM\CurrentControlSet\Services\wercplsupport,,,failed,,,all
1151260429,26093,cis_win11_enterprise_21H2,Ensure 'Remote Access Auto Connection Manager (RasAuto)' is set to 'Disabled'.,Creates a connection to a remote network whenever a program references a remote DNS or NetBIOS name or address. The recommended state for this setting is: Disabled.,"The function of this service is to provide a 'demand dial' type of functionality. In a high security environment, it is preferred that any remote 'dial' connections (whether they be legacy dial-in POTS or VPN) are initiated by the user, not automatically by the system.","To establish the recommended configuration via GP, set the following UI path to: Disabled. Computer Configuration\Policies\Windows Settings\Security Settings\System Services\Remote Access Auto Connection Manager",,,,HKEY_LOCAL_MACHINE\SYSTEM\CurrentControlSet\Services\RasAuto,,,failed,,,all
1151260429,26094,cis_win11_enterprise_21H2,Ensure 'Remote Desktop Configuration (SessionEnv)' is set to 'Disabled'.,"Remote Desktop Configuration service (RDCS) is responsible for all Remote Desktop related configuration and session maintenance activities that require SYSTEM context. These include per-session temporary folders, RD themes, and RD certificates. The recommended state for this setting is: Disabled.","In a high security environment, Remote Desktop access is an increased security risk. For these environments, only local console access should be permitted.","To establish the recommended configuration via GP, set the following UI path to: Disabled. Computer Configuration\Policies\Windows Settings\Security Settings\System Services\Remote Desktop Configuration",,,,HKEY_LOCAL_MACHINE\SYSTEM\CurrentControlSet\Services\SessionEnv,,,failed,,,all
1151260429,26095,cis_win11_enterprise_21H2,Ensure 'Remote Desktop Services (TermService)' is set to 'Disabled'.,Allows users to connect interactively to a remote computer. Remote Desktop and Remote Desktop Session Host Server depend on this service. The recommended state for this setting is: Disabled.,"In a high security environment, Remote Desktop access is an increased security risk. For these environments, only local console access should be permitted.","To establish the recommended configuration via GP, set the following UI path to: Disabled. Computer Configuration\Policies\Windows Settings\Security Settings\System Services\Remote Desktop Services",,,,HKEY_LOCAL_MACHINE\SYSTEM\CurrentControlSet\Services\TermService,,,failed,,,all
1151260429,26096,cis_win11_enterprise_21H2,Ensure 'Remote Desktop Services UserMode Port Redirector (UmRdpService)' is set to 'Disabled'.,Allows the redirection of Printers/Drives/Ports for RDP connections. The recommended state for this setting is: Disabled.,"In a security-sensitive environment, it is desirable to reduce the possible attack surface - preventing the redirection of COM, LPT and PnP ports will reduce the number of unexpected avenues for data exfiltration and/or malicious code transfer within an RDP session.","To establish the recommended configuration via GP, set the following UI path to: Disabled. Computer Configuration\Policies\Windows Settings\Security Settings\System Services\Remote Desktop Services UserMode Port Redirector",,,,HKEY_LOCAL_MACHINE\SYSTEM\CurrentControlSet\Services\UmRdpService,,,failed,,,all
1151260429,26097,cis_win11_enterprise_21H2,Ensure 'Remote Procedure Call (RPC) Locator (RpcLocator)' is set to 'Disabled'.,"In Windows 2003 and older versions of Windows, the Remote Procedure Call (RPC) Locator service manages the RPC name service database. In Windows Vista and newer versions of Windows, this service does not provide any functionality and is present for application compatibility. The recommended state for this setting is: Disabled.",This is a legacy service that has no value or purpose other than application compatibility for very old software. It should be disabled unless there is a specific old application still in use on the system that requires it.,"To establish the recommended configuration via GP, set the following UI path to: Disabled. Computer Configuration\Policies\Windows Settings\Security Settings\System Services\Remote Procedure Call (RPC) Locator",,,,HKEY_LOCAL_MACHINE\SYSTEM\CurrentControlSet\Services\RpcLocator,,,failed,,,all
1151260429,26098,cis_win11_enterprise_21H2,Ensure 'Remote Registry (RemoteRegistry)' is set to 'Disabled'.,Enables remote users to view and modify registry settings on this computer. The recommended state for this setting is: Disabled.,"In a high security environment, exposing the registry to remote access is an increased security risk.","To establish the recommended configuration via GP, set the following UI path to: Disabled. Computer Configuration\Policies\Windows Settings\Security Settings\System Services\Remote Registry",,,,HKEY_LOCAL_MACHINE\SYSTEM\CurrentControlSet\Services\RemoteRegistry,,,passed,,,all
1151260429,26099,cis_win11_enterprise_21H2,Ensure 'Routing and Remote Access (RemoteAccess)' is set to 'Disabled'.,Offers routing services to businesses in local area and wide area network environments. The recommended state for this setting is: Disabled.,This service's main purpose is to provide Windows router functionality - this is not an appropriate use of workstations in an enterprise managed environment.,"To establish the recommended configuration via GP, set the following UI path to: Disabled. Computer Configuration\Policies\Windows Settings\Security Settings\System Services\Routing and Remote Access",,,,HKEY_LOCAL_MACHINE\SYSTEM\CurrentControlSet\Services\RemoteAccess,,,passed,,,all
1151260429,26100,cis_win11_enterprise_21H2,Ensure 'Server (LanmanServer)' is set to 'Disabled'.,"Supports file, print, and named-pipe sharing over the network for this computer. If this service is stopped, these functions will be unavailable. The recommended state for this setting is: Disabled.","In a high security environment, a secure workstation should only be a client, not a server. Sharing workstation resources for remote access increases security risk as the attack surface is notably higher.","To establish the recommended configuration via GP, set the following UI path to: Disabled. Computer Configuration\Policies\Windows Settings\Security Settings\System Services\Server",,,,HKEY_LOCAL_MACHINE\SYSTEM\CurrentControlSet\Services\LanmanServer,,,failed,,,all
1151260429,26101,cis_win11_enterprise_21H2,Ensure 'Simple TCP/IP Services (simptcp)' is set to 'Disabled' or 'Not Installed'.,"Supports the following TCP/IP services: Character Generator, Daytime, Discard, Echo, and Quote of the Day. The recommended state for this setting is: Disabled or Not Installed. Note: This service is not installed by default. It is supplied with Windows, but is installed by enabling an optional Windows feature (Simple TCPIP services (i.e. echo, daytime etc)).",The Simple TCP/IP Services have very little purpose in a modern enterprise environment - allowing them might increase exposure and risk for attack.,"To establish the recommended configuration via GP, set the following UI path to: Disabled or ensure the service is not installed. Computer Configuration\Policies\Windows Settings\Security Settings\System Services\Simple TCP/IP Services",,,,HKEY_LOCAL_MACHINE\SYSTEM\CurrentControlSet\Services\simptcp,,,passed,,,any
1151260429,26102,cis_win11_enterprise_21H2,Ensure 'SNMP Service (SNMP)' is set to 'Disabled' or 'Not Installed'.,"Enables Simple Network Management Protocol (SNMP) requests to be processed by this computer. The recommended state for this setting is: Disabled or Not Installed. Note: This service is not installed by default. It is supplied with Windows, but is installed by enabling an optional Windows feature (Simple Network Management Protocol (SNMP)).","Features that enable inbound network connections increase the attack surface. In a high security environment, management of secure workstations should be handled locally.","To establish the recommended configuration via GP, set the following UI path to: Disabled or ensure the service is not installed. Computer Configuration\Policies\Windows Settings\Security Settings\System Services\SNMP Service",,,,HKEY_LOCAL_MACHINE\SYSTEM\CurrentControlSet\Services\SNMP,,,passed,,,any
1151260429,26103,cis_win11_enterprise_21H2,Ensure 'Special Administration Console Helper (sacsvr)' is set to 'Disabled' or 'Not Installed'.,"This service allows administrators to remotely access a command prompt using Emergency Management Services. The recommended state for this setting is: Disabled or Not Installed. Note: This service is not installed by default. It is supplied with Windows, but it is installed by enabling an optional Windows capability (Windows Emergency Management Services and Serial Console).",Allowing the use of a remotely accessible command prompt that provides the ability to perform remote management tasks on a computer is a security risk.,"To establish the recommended configuration via GP, set the following UI path to: Disabled or ensure the service is not installed. Computer Configuration\Policies\Windows Settings\Security Settings\System Services\Special Administration Console Helper",,,,HKEY_LOCAL_MACHINE\SYSTEM\CurrentControlSet\Services\sacsvr,,,passed,,,any
1151260429,26104,cis_win11_enterprise_21H2,Ensure 'SSDP Discovery (SSDPSRV)' is set to 'Disabled'.,"Discovers networked devices and services that use the SSDP discovery protocol, such as UPnP devices. Also announces SSDP devices and services running on the local computer. The recommended state for this setting is: Disabled.",Universal Plug n Play (UPnP) is a real security risk - it allows automatic discovery and attachment to network devices. Note that UPnP is different than regular Plug n Play (PnP). Workstations should not be advertising their services (or automatically discovering and connecting to networked services) in a security-conscious enterprise managed environment.,"To establish the recommended configuration via GP, set the following UI path to: Disabled. Computer Configuration\Policies\Windows Settings\Security Settings\System Services\SSDP Discovery",,,,HKEY_LOCAL_MACHINE\SYSTEM\CurrentControlSet\Services\SSDPSRV,,,failed,,,all
1151260429,26105,cis_win11_enterprise_21H2,Ensure 'UPnP Device Host (upnphost)' is set to 'Disabled'.,Allows UPnP devices to be hosted on this computer. The recommended state for this setting is: Disabled.,Universal Plug n Play (UPnP) is a real security risk - it allows automatic discovery and attachment to network devices. Notes that UPnP is different than regular Plug n Play (PnP). Workstations should not be advertising their services (or automatically discovering and connecting to networked services) in a security-conscious enterprise managed environment.,"To establish the recommended configuration via GP, set the following UI path to: Disabled. Computer Configuration\Policies\Windows Settings\Security Settings\System Services\UPnP Device Host",,,,HKEY_LOCAL_MACHINE\SYSTEM\CurrentControlSet\Services\upnphost,,,failed,,,all
1151260429,26106,cis_win11_enterprise_21H2,Ensure 'Web Management Service (WMSvc)' is set to 'Disabled' or 'Not Installed'.,"The Web Management Service enables remote and delegated management capabilities for administrators to manage for the Web server, sites and applications present on the machine. The recommended state for this setting is: Disabled or Not Installed. Note: This service is not installed by default. It is supplied with Windows, but is installed by enabling an optional Windows feature (Internet Information Services - Web Management Tools - IIS Management Service).","Remote web administration of IIS on a workstation is an increased security risk, as the attack surface of that workstation is then greatly increased. If proper security mitigations are not followed, the chance of successful attack increases significantly.","To establish the recommended configuration via GP, set the following UI path to: Disabled or ensure the service is not installed. Computer Configuration\Policies\Windows Settings\Security Settings\System Services\Web Management Service",,,,HKEY_LOCAL_MACHINE\SYSTEM\CurrentControlSet\Services\WMSvc,,,passed,,,any
1151260429,26107,cis_win11_enterprise_21H2,Ensure 'Windows Error Reporting Service (WerSvc)' is set to 'Disabled'.,Allows errors to be reported when programs stop working or responding and allows existing solutions to be delivered. Also allows logs to be generated for diagnostic and repair services. The recommended state for this setting is: Disabled.,"If a Windows Error occurs in a secure, enterprise managed environment, the error should be reported directly to IT staff for troubleshooting and remediation. There is no benefit to the corporation to report these errors directly to Microsoft, and there is some risk of unknowingly exposing sensitive data as part of the error.","To establish the recommended configuration via GP, set the following UI path to: Disabled. Computer Configuration\Policies\Windows Settings\Security Settings\System Services\Windows Error Reporting Service",,,,HKEY_LOCAL_MACHINE\SYSTEM\CurrentControlSet\Services\WerSvc,,,failed,,,all
1151260429,26108,cis_win11_enterprise_21H2,Ensure 'Windows Event Collector (Wecsvc)' is set to 'Disabled'.,"This service manages persistent subscriptions to events from remote sources that support WS-Management protocol. This includes Windows Vista event logs, hardware and IPMI-enabled event sources. The service stores forwarded events in a local Event Log. The recommended state for this setting is: Disabled.","In a high security environment, remote connections to secure workstations should be minimized, and management functions should be done locally.","To establish the recommended configuration via GP, set the following UI path to: Disabled. Computer Configuration\Policies\Windows Settings\Security Settings\System Services\Windows Event Collector",,,,HKEY_LOCAL_MACHINE\SYSTEM\CurrentControlSet\Services\Wecsvc,,,failed,,,all
1151260429,26109,cis_win11_enterprise_21H2,Ensure 'Windows Media Player Network Sharing Service (WMPNetworkSvc)' is set to 'Disabled' or 'Not Installed'.,Shares Windows Media Player libraries to other networked players and media devices using Universal Plug and Play. The recommended state for this setting is: Disabled or Not Installed.,Network sharing of media from Media Player has no place in an enterprise managed environment.,"To establish the recommended configuration via GP, set the following UI path to: Disabled or ensure the service is not installed. Computer Configuration\Policies\Windows Settings\Security Settings\System Services\Windows Media Player Network Sharing Service",,,,HKEY_LOCAL_MACHINE\SYSTEM\CurrentControlSet\Services\WMPNetworkSvc,,,failed,,,any
1151260429,26110,cis_win11_enterprise_21H2,Ensure 'Windows Mobile Hotspot Service (icssvc)' is set to 'Disabled'.,Provides the ability to share a cellular data connection with another device. The recommended state for this setting is: Disabled.,The capability to run a mobile hotspot from a domain-connected computer could easily expose the internal network to wardrivers or other hackers.,"To establish the recommended configuration via GP, set the following UI path to: Disabled. Computer Configuration\Policies\Windows Settings\Security Settings\System Services\Windows Mobile Hotspot Service",,,,HKEY_LOCAL_MACHINE\SYSTEM\CurrentControlSet\Services\icssvc,,,failed,,,all
1151260429,26111,cis_win11_enterprise_21H2,Ensure 'Windows Push Notifications System Service (WpnService)' is set to 'Disabled'.,"This service runs in session 0 and hosts the notification platform and connection provider which handles the connection between the device and WNS server. The recommended state for this setting is: Disabled. Note: In the first two releases of Windows 10 (R1507 & R1511), the display name of this service was initially named Windows Push Notifications Service - but it was renamed to Windows Push Notifications System Service starting with Windows 10 R1607.","Windows Push Notification Services (WNS) is a mechanism to receive 3rd-party notifications and updates from the cloud/Internet. In a high security environment, external systems, especially those hosted outside the organization, should be prevented from having an impact on the secure workstations.","To establish the recommended configuration via GP, set the following UI path to: Disabled. Computer Configuration\Policies\Windows Settings\Security Settings\System Services\Windows Push Notifications System Service",,,,HKEY_LOCAL_MACHINE\SYSTEM\CurrentControlSet\Services\WpnService,,,failed,,,all
1151260429,26112,cis_win11_enterprise_21H2,Ensure 'Windows PushToInstall Service (PushToInstall)' is set to 'Disabled'.,This service manages Apps that are pushed to the device from the Microsoft Store App running on other devices or the web. The recommended state for this setting is: Disabled.,"In a high security managed environment, application installations should be managed centrally by IT staff, not by end users.","To establish the recommended configuration via GP, set the following UI path to: Disabled. Computer Configuration\Policies\Windows Settings\Security Settings\System Services\Windows PushToInstall Service (PushToInstall)",,,,HKEY_LOCAL_MACHINE\SYSTEM\CurrentControlSet\Services\PushToInstall,,,failed,,,all
